{
  "contract_version": "2.0.0",
  "intent_id": "0123456789abcdef0123456789abcdef",
  "status": "stored",
  "source": {
    "source_id": "document:0123456789abcdef0123456789abcdef",
    "native_document_uuid": "01234567-89ab-cdef-0123-456789abcdef",
    "content_hash": "aaaaaaaaaaaaaaaaaaaaaaaaaaaaaaaaaaaaaaaaaaaaaaaaaaaaaaaaaaaaaaaaaaaaaaaaaaaaaaaaaaaaaaaaaaaaaaaaaaaaaaaaaaaaaaaaaaaaaaaaaaaaaaaa",
    "version": 1,
    "document_type": "lab_pdf",
    "mime_type": "application/pdf",
    "byte_size": 512,
    "page_count": 1
  }
}
